email,name,skills,project,project_details,project_skills
thomas.nelson@test.org,Thomas Nelson,"Security, Pandas, Go",Data Analytics,"A data analytics project transforming raw data into insights through visualization, statistics, and machine learning for smarter decisions.","Pandas,Tableau,Big Data, Scala,Spark"
lucy.clark@test.org,Lucy Clark,"WordPress, Scrum, Go, SQL, Linux",UI Design,"A UI design project creating intuitive, user-friendly, and visually appealing interfaces that enhance usability and overall digital experience.","CSS3,Angular,HTML5,Express.js,JavaScript"
richard.jackson@test.org,Richard Jackson,"System Design, PyTorch, Express.js, DevOps",DevOPS ,"A DevOps project automating development, testing, and deployment pipelines to ensure faster delivery, scalability, and continuous integration.","CI/CD,DevOps,Agile,Cloud Architecture,Angular,SQL,Security"
amelia.hall@test.org,Amelia Hall,"Agile, CSS3, R, Azure",UI Design,"A UI design project creating intuitive, user-friendly, and visually appealing interfaces that enhance usability and overall digital experience.","CSS3,Angular,HTML5,Express.js,JavaScript"
david.hill@test.org,David Hill,"Java, Scrum, Angular",Other Projects,"An IT project delivering secure, scalable, and efficient technology solutions to streamline processes, enhance performance, and drive business growth.","CI/CD,Agile,JavaScript,Blockchain,SQL,Cypher"
christopher.johnson@test.org,Christopher Johnson,"Tableau, Flask, API Design",Data Analytics,"A data analytics project transforming raw data into insights through visualization, statistics, and machine learning for smarter decisions.","Pandas,Tableau,Big Data, Scala,Spark"
amelia.martin@test.org,Amelia Martin,"CI/CD, Kotlin, HTML5, TensorFlow",DevOPS ,"A DevOps project automating development, testing, and deployment pipelines to ensure faster delivery, scalability, and continuous integration.","CI/CD,DevOps,Agile,Cloud Architecture,Angular,SQL,Security"
daniel.hill@test.org,Daniel Hill,"System Design, Git, Cypher, Pandas, Spring Boot",Other Projects,"An IT project delivering secure, scalable, and efficient technology solutions to streamline processes, enhance performance, and drive business growth.","Scrum,Rust"
alice.white@test.org,Alice White,"Spark, Agile, JavaScript",Other Projects,"An IT project delivering secure, scalable, and efficient technology solutions to streamline processes, enhance performance, and drive business growth.","Scrum,Rust"
lucy.taylor@test.org,Lucy Taylor,"Flask, Tableau, CI/CD, Rust, System Design",Data Analytics,"A data analytics project transforming raw data into insights through visualization, statistics, and machine learning for smarter decisions.","Pandas,Tableau,Big Data, Scala,Spark"
lucy.turner@test.org,Lucy Turner,"Express.js, Big Data, Scala, Security, Docker",UI Design,"A UI design project creating intuitive, user-friendly, and visually appealing interfaces that enhance usability and overall digital experience.","CSS3,Angular,HTML5,Express.js,JavaScript"
elena.young@test.org,Elena Young,"Scala, TensorFlow, Blockchain, Angular",Other Projects,"This IT project focuses on developing secure, scalable, and efficient technology solutions to meet organizational needs. It involves system integration, process automation, and infrastructure optimization to improve performance and reliability. By leveraging modern tools and best practices, the project ensures enhanced productivity, data security, and long-term business growth.","CI/CD,Agile,JavaScript,Blockchain,SQL,Cypher"
richard.taylor@test.org,Richard Taylor,"Cloud Architecture, Kotlin, Angular, Agile",DevOPS ,"A DevOps project automating development, testing, and deployment pipelines to ensure faster delivery, scalability, and continuous integration.","CI/CD,DevOps,Agile,Cloud Architecture,Angular,SQL,Security"
joseph.mitchell@test.org,Joseph Mitchell,"System Design, Spark, Vue.js, Ruby",Data Analytics,"A data analytics project transforming raw data into insights through visualization, statistics, and machine learning for smarter decisions.","Pandas,Tableau,Big Data, Scala,Spark"
sophie.jackson@test.org,Sophie Jackson,"Linux, Angular, Security, Pandas",Other Projects,"This IT project focuses on developing secure, scalable, and efficient technology solutions to meet organizational needs. It involves system integration, process automation, and infrastructure optimization to improve performance and reliability. By leveraging modern tools and best practices, the project ensures enhanced productivity, data security, and long-term business growth.","CI/CD,Agile,JavaScript,Blockchain,SQL,Cypher"
